[
		{
			"contributorName": "Your Name",
			"Creator": "Yes",
			"contributorType": ["Researcher"],
			"nameType": ["Personal"],
			"nameIdentifier": ["YN"],
			"nameIdentifierScheme": ["GRID"],
			"affiliation": ["Also YN"],
			"affiliationIdentifier": ["AYN"],
			"affiliationIdentifierScheme": ["GRID"]
		},
		{
			"contributorName": "Your Name 2",
			"Creator": "Yes",
			"contributorType": ["Researcher", "ProjectLeader"],
			"nameType": ["Personal", "Organizational"],
			"nameIdentifier": ["YN"],
			"nameIdentifierScheme": ["GRID", "ROR", "RRID"],
			"affiliation": ["Also YN", "Another"],
			"affiliationIdentifier": ["AYN"],
			"affiliationIdentifierScheme": ["ISNI", "ORCID"]
		}
	]